{"schema_version":1,"workspace_id":"ws_alpha","scope":{"kind":"project","project_id":"proj"},"endpoint_id":"endpoint_one","agent_id":"agent_codex","adapter_name":"native_adapter","adapter_revision":"r1","trust_class":"managed","capability_set_id":"caps_one","platform":{"os":"linux","architecture":"arm64","runtime_version":"1.0"},"configuration_ref":{"registry_id":"endpoint_registry","revision":"r1","reference":"endpoint_one_config"}}
